{
  "$schema": "https://schemas.aoa.local/models/model-claim.schema.json",
  "schema_version": "aoa_model_claim_v1",
  "kind": "ModelClaim",
  "model_claim_id": "model-claim:openai/gpt-5.6-luna/codex-0.148.0-currentness-nontransfer-hypothesis-v1",
  "subject_realization_refs": [
    "source/model-realizations/openai-gpt-5.6-luna-codex-0.148.0-chatgpt-max-structured-owner-duty-workspace-write.json"
  ],
  "statement": "The exact content-addressed runtime subject for the Codex 0.148.0 Luna max structured-owner-duty realization is compatible with the observed live catalog and may enter a new bounded canary, but ambient catalog facts or evidence from another runtime subject do not transfer behavioral fit, reliability, wake delivery, or owner acceptance.",
  "scope": {
    "task_family": "structured-owner-duty-currentness",
    "conditions": [
      "the exact runtime_subject source and digest match the runtime binding, and the package plus required companions are artifact-admitted before launch",
      "the selected realization, runtime profile, model slug, reasoning effort, permissions and tool profile match exactly",
      "a new bounded real-work canary returns runtime receipts and separately reviewed evidence before any fit promotion",
      "the live Codex catalog remains compatible with the same runtime subject at launch time"
    ],
    "exclusions": [
      "transferring any Codex 0.147.0 task outcome, fit, reliability, handoff, wake, resume, or acceptance claim",
      "using an ambient Codex catalog observation to establish currentness for another runtime subject",
      "using catalog compatibility as activation, routing, process health, proof, or owner acceptance",
      "claiming general Luna competence, autonomy, initiative, or evaluator authority",
      "inferring closed-model internals or training lineage from runtime availability"
    ]
  },
  "evidence_modality": "inference_with_explicit_limits",
  "evidence_refs": [
    {
      "source_id": "local-codex-0.148.0-luna-catalog-2026-08-20",
      "kind": "live_runtime_output",
      "uri": "command:codex-debug-models-jq-luna-compact",
      "observed_at": "2026-08-20T17:25:23Z",
      "content_digest": "sha256:b92dbc71807eb3ad48663229cd6cf9e4ddce413fd659ca8207e73cb0870a792f",
      "notes": "Confirms exact 0.148.0 catalog compatibility for Luna max; it does not execute the realization or prove task fit."
    },
    {
      "source_id": "local-codex-0.148.0-runtime-package-subject-2026-08-20",
      "kind": "live_runtime_output",
      "uri": "runtime:codex-cli-standalone/current",
      "observed_at": "2026-08-20T22:15:49Z",
      "content_digest": "sha256:35cc6b0e4e5c527569807be8017b705f410f0c6c2b7a3fa1c6a5407d65889041",
      "notes": "Binds the realization to one exact package subject; an equal version with another source or digest is not the same currentness subject."
    },
    {
      "source_id": "luna-max-0.147.0-structured-owner-duty-stale-source",
      "kind": "repository_source",
      "uri": "repo:aoa-models@ffed04f#source/model-claims/luna-bounded-eval-role-fit-max-structured-owner-duty-hypothesis-v1.json",
      "observed_at": "2026-08-20T17:25:23Z",
      "content_digest": "sha256:5c6f3c10ec76e2023eb313c3210fdc592aab640ec69d85987cd42399911a116d",
      "notes": "The prior bounded hypothesis is stale and explicitly says a future 0.148.0 canary must re-establish currentness before fit is considered."
    },
    {
      "source_id": "codex-0.149.1-current-runtime-subject",
      "kind": "live_runtime_output",
      "uri": "file:/srv/abyss-machine/runtimes/abyss-stack/external-codex-agent/releases/sha256-0946e21178a033482b321e90e04efcaeb7e10b2dbac2af7d76ab196be58559c1/runtime/runtime-profile.v1.json",
      "observed_at": "2026-08-25T19:36:31Z",
      "content_digest": "sha256:304089232ad96d67bf003f0fb59b2fccf305259ac5a1983e969aa6f1b85ca891",
      "notes": "The current abyss-stack active release admits Codex CLI 0.149.1 with a different exact runtime subject; the prior 0.148.0 realization is no longer current. This transition does not transfer workspace-write behavior or fit."
    }
  ],
  "confidence_posture": "hypothesis",
  "observation_interval": {
    "start": "2026-08-20T17:25:23Z",
    "end": "2026-08-25T20:03:48Z"
  },
  "known_counterevidence": [
    {
      "source_id": "luna-max-0.147.0-adjacent-real-work-does-not-transfer",
      "kind": "repository_source",
      "uri": "repo:aoa-models@ffed04f#source/model-realizations/openai-gpt-5.6-luna-codex-0.147.0-chatgpt-max-structured-owner-duty-workspace-write.json",
      "observed_at": "2026-08-20T17:25:23Z",
      "content_digest": "sha256:a850643e0b0de105aa33a9c526b5078387219263193cab35368e5674db8f10f2",
      "notes": "Adjacent 0.147.0 writer and reviewer evidence exists, but the exact realization is stale and cannot establish 0.148.0 behavior."
    },
    {
      "source_id": "codex-0.149.1-current-subject-counterevidence",
      "kind": "live_runtime_output",
      "uri": "file:/srv/abyss-machine/runtimes/abyss-stack/external-codex-agent/releases/sha256-0946e21178a033482b321e90e04efcaeb7e10b2dbac2af7d76ab196be58559c1/runtime/runtime-profile.v1.json",
      "observed_at": "2026-08-25T19:36:31Z",
      "content_digest": "sha256:304089232ad96d67bf003f0fb59b2fccf305259ac5a1983e969aa6f1b85ca891",
      "notes": "The active runtime has advanced to 0.149.1 and a different exact subject, which is direct counterevidence to retaining 0.148.0 as current."
    }
  ],
  "freshness": {
    "status": "stale",
    "review_by": null,
    "policy": "Preserve this 0.148.0 realization as historical evidence. It is stale after the exact runtime subject changed to 0.149.1; behavioral fit remains unestablished and must not be transferred to another realization."
  },
  "lifecycle": {
    "state": "stale",
    "history": [
      {
        "from": null,
        "to": "hypothesis",
        "at": "2026-08-20T17:25:23Z",
        "reason": "A fresh catalog observation plus an exact runtime_subject package digest establishes currentness only for this subject; the previous 0.147.0 owner-duty hypothesis and evidence are stale by exact-runtime identity.",
        "evidence_refs": [
          "local-codex-0.148.0-luna-catalog-2026-08-20",
          "local-codex-0.148.0-runtime-package-subject-2026-08-20",
          "luna-max-0.147.0-structured-owner-duty-stale-source"
        ]
      },
      {
        "from": "hypothesis",
        "to": "stale",
        "at": "2026-08-25T20:03:48Z",
        "reason": "The active Codex runtime advanced to 0.149.1 with a different exact runtime subject; the 0.148.0 currentness hypothesis is preserved and cannot satisfy the current read-only consumer query.",
        "evidence_refs": [
          "codex-0.149.1-current-runtime-subject"
        ]
      }
    ],
    "superseded_by": null
  },
  "independent_review_refs": [],
  "attribution_limits": [
    "The live catalog proves availability and declared configuration compatibility only for the matching runtime_subject.",
    "A version match without an exact runtime_subject source and digest is insufficient currentness evidence.",
    "The new realization has not yet completed a real task through the repaired external actor route.",
    "No 0.147.0 execution receipt, review, wake, or fit conclusion is attributed to the 0.148.0 realization.",
    "Runtime package admission, process truth, wake delivery, proof, routing, and owner acceptance remain with their stronger owners."
  ],
  "created_at": "2026-08-20T17:25:23Z",
  "updated_at": "2026-08-25T20:03:48Z"
}
