{
  "$schema": "https://schemas.aoa.local/models/model-claim.schema.json",
  "schema_version": "aoa_model_claim_v1",
  "kind": "ModelClaim",
  "model_claim_id": "model-claim:openai/gpt-5.6-luna/bounded-landing-fit-transfer-hypothesis-v2",
  "subject_realization_refs": [
    "source/model-realizations/openai-gpt-5.6-luna-codex-0.147.0-chatgpt-max-readonly.json",
    "source/model-realizations/openai-gpt-5.6-luna-codex-0.147.0-chatgpt-max-workspace-write.json",
    "source/model-realizations/openai-gpt-5.6-luna-codex-0.147.0-chatgpt-xhigh-readonly.json",
    "source/model-realizations/openai-gpt-5.6-luna-codex-0.147.0-chatgpt-xhigh-workspace-write.json"
  ],
  "statement": "GPT-5.6 Luna xhigh or max under the exact Codex 0.147.0 realization may retain the bounded landing suitability observed under Codex 0.146.0, but current fit remains a transfer hypothesis until a real external-process regression returns through owner review.",
  "scope": {
    "task_family": "landing",
    "conditions": [
      "the target owner and source of truth are explicit",
      "architecture and authority boundaries are already decided",
      "the done state and validators are inspectable",
      "acceptance remains with the target owner and proof route",
      "the exact Codex 0.147.0 realization passes the live catalog check",
      "the bound abyss-stack runtime profile exists and is admitted before launch"
    ],
    "exclusions": [
      "architectural or owner-boundary decisions",
      "semantic merge conflicts with materially different futures",
      "autonomous commit, push, merge, release, publication, or other external effects",
      "claims about internal geometry or training data inferred from behavior alone",
      "treating compatibility with the live model catalog as runtime-profile availability or task-fit proof",
      "transferring Codex 0.146.0 outcome evidence to 0.147.0 without a new real-work regression"
    ]
  },
  "evidence_modality": "inference_with_explicit_limits",
  "evidence_refs": [
    {
      "source_id": "codex-0.146.0-bounded-landing-fit-claim",
      "kind": "repository_source",
      "uri": "source/model-claims/luna-bounded-landing-fit-hypothesis.json",
      "observed_at": "2026-08-08T08:12:22Z",
      "content_digest": null,
      "notes": "The stale predecessor preserves the actual landing trials, independent reviews, counterevidence, and attribution limits. It informs this transfer hypothesis but does not prove current fit."
    },
    {
      "source_id": "local-codex-model-catalog-luna-2026-08-08",
      "kind": "live_runtime_output",
      "uri": "command:codex-debug-models#gpt-5.6-luna",
      "observed_at": "2026-08-08T08:12:22Z",
      "content_digest": "sha256:4b383dc91a67d6a214c5d592de0882221d2c968c2a7bd0b2fe53c2370cd56563",
      "notes": "The live Codex catalog confirms Luna, xhigh and max, the Codex context regime, API support, and backend v1 under Codex 0.147.0."
    },
    {
      "source_id": "openai-gpt-5.6-luna-model-2026-08-08",
      "kind": "official_documentation",
      "uri": "https://developers.openai.com/api/docs/models/gpt-5.6-luna",
      "observed_at": "2026-08-08T08:12:22Z",
      "content_digest": null,
      "notes": "OpenAI describes Luna as the cost-sensitive high-volume GPT-5.6 variant and publishes its native API context and economics."
    },
    {
      "source_id": "luna-max-runtime-update-writer-return-2026-08-15",
      "kind": "execution_receipt",
      "uri": "file:/srv/abyss-machine/tmp/ai/aoa-external-actors-goal-20260808/live-proof-20260814/runtime-update-luna-20260814/final-d5/owner-writer-state-d5-v1/sessions/579f5e3010eeaf358fa628ef05ed4626/attempts/002/model-report.json",
      "observed_at": "2026-08-15T06:45:00Z",
      "content_digest": "sha256:99cd25487cbca5f4cf4bf290b019c2d7352e8b9721cf5b1a3907bd12f3f4739e",
      "notes": "Fresh Max real-work return supports a bounded owner-reviewed source repair, but it is runtime-update evidence and does not establish landing transfer or model-fit promotion."
    },
    {
      "source_id": "luna-max-pr379-authority-stop-2026-08-14",
      "kind": "execution_receipt",
      "uri": "file:/srv/abyss-machine/tmp/ai/aoa-external-actors-goal-20260808/live-proof-20260814/pr379-ci-landing-writer-state-v2/sessions/079d6724fc4acb42d978c82a68daf1b6/runtime-failure.json",
      "observed_at": "2026-08-14T23:00:00Z",
      "content_digest": "sha256:217374816cbe97878cbeb9b882743be46bc7d42695e96a09922e76e031ec3cae",
      "notes": "Fresh Max landing attempt stopped at a workspace-manifest observation gap with no changed paths; it is direct counterevidence against treating the transfer as established."
    },
    {
      "source_id": "aoa-evals-owner-contract-selection-2026-08-15",
      "kind": "repository_source",
      "uri": "file:/srv/abyss-machine/tmp/ai/aoa-external-actors-goal-20260808/live-proof-20260814/eval-model-luna-owner-procedure.json",
      "observed_at": "2026-08-15T10:45:00Z",
      "content_digest": "sha256:99f6d3d8da040b2324fb426ee753f1abc790d0313dfefbe1175cc0d7d3e1c644",
      "notes": "Owner-source eval selection keeps the current model-work review bounded and separate from landing-fit transfer."
    }
  ],
  "confidence_posture": "hypothesis",
  "observation_interval": {
    "start": "2026-08-08T08:12:22Z",
    "end": null
  },
  "known_counterevidence": [
    {
      "source_id": "luna-max-pr379-authority-stop-counterevidence-2026-08-14",
      "kind": "execution_receipt",
      "uri": "file:/srv/abyss-machine/tmp/ai/aoa-external-actors-goal-20260808/live-proof-20260814/pr379-ci-landing-writer-state-v2/sessions/079d6724fc4acb42d978c82a68daf1b6/runtime-failure.json",
      "observed_at": "2026-08-14T23:00:00Z",
      "content_digest": "sha256:217374816cbe97878cbeb9b882743be46bc7d42695e96a09922e76e031ec3cae",
      "notes": "The Max landing attempt was authority_blocked because workspace_manifest_observation_gap remained unresolved; no landing change was returned."
    },
    {
      "source_id": "aoa-models-evaluator-fit-query-is-xhigh-readonly-2026-08-14",
      "kind": "live_runtime_output",
      "uri": "file:/srv/abyss-machine/tmp/ai/aoa-external-actors-goal-20260808/live-proof-20260814/evaluator-live-duty-fit-query-main-5df7882.json",
      "observed_at": "2026-08-14T00:00:00Z",
      "content_digest": "sha256:777ad7ca5a224eeaa1fd42de4afcf7366644cb9a57e2ed4f1f615f6f38c44295",
      "notes": "The earlier exact evaluator fit query selected xhigh read-only, not Max structured-owner-duty; it remains informational and cannot be used as a Max transfer result."
    },
    {
      "source_id": "task-local-acceptance-matrix-evaluator-intake-gap",
      "kind": "repository_source",
      "uri": "file:/srv/abyss-machine/tmp/ai/aoa-external-actors-goal-20260808/live-proof-20260814/ACCEPTANCE_MATRIX.md#L16-L20",
      "observed_at": "2026-08-15T00:00:00Z",
      "content_digest": null,
      "notes": "Normal evaluator intake and live scoped MCP proof remain partial or missing in the task-local acceptance matrix."
    }
  ],
  "freshness": {
    "status": "current",
    "review_by": "2026-08-22T00:00:00Z",
    "policy": "Current only as a reviewed-but-unpromoted Codex 0.147.0 transfer hypothesis. The Max structured-owner-duty review is a separate eval/model record; a real external landing regression must still strengthen, narrow, weaken, stale, or retract this transfer hypothesis before operational admission."
  },
  "lifecycle": {
    "state": "hypothesis",
    "history": [
      {
        "from": null,
        "to": "hypothesis",
        "at": "2026-08-08T08:12:22Z",
        "reason": "A live Codex 0.147.0 catalog observation plus bounded 0.146.0 landing evidence justify a new regression candidate, not transferred proof.",
        "evidence_refs": [
          "codex-0.146.0-bounded-landing-fit-claim",
          "local-codex-model-catalog-luna-2026-08-08"
        ]
      }
    ],
    "superseded_by": null
  },
  "independent_review_refs": [],
  "attribution_limits": [
    "The Codex 0.147.0 realizations are declared from current catalog and owner inputs but have not yet completed an external actor run.",
    "The stale Codex 0.146.0 claim preserves relevant evidence but does not prove behavior or net benefit under 0.147.0.",
    "The active ChatGPT quota regime does not expose direct per-run USD billing; API prices remain reference economics.",
    "The declared landing runtime profiles must be implemented and admitted by abyss-stack before any launch.",
    "No behavioral result may be used to infer closed-model internal geometry or training lineage."
  ],
  "created_at": "2026-08-08T08:12:22Z",
  "updated_at": "2026-08-15T10:45:00Z"
}
