{
  "$schema": "https://schemas.aoa.local/models/model-claim.schema.json",
  "schema_version": "aoa_model_claim_v1",
  "kind": "ModelClaim",
  "model_claim_id": "model-claim:openai/gpt-5.6-luna/codex-0.149.1-currentness-nontransfer-hypothesis-v1",
  "subject_realization_refs": [
    "source/model-realizations/openai-gpt-5.6-luna-codex-0.149.1-chatgpt-max-structured-owner-duty-workspace-write.json"
  ],
  "statement": "The exact content-addressed runtime subject for the Codex 0.149.1 Luna max structured-owner-duty realization is a declared currentness candidate from owner-supplied package metadata and admitted subject evidence only; no Codex 0.148.0 behavioral fit, outcome, reliability, wake, resume, or acceptance claim transfers to this subject.",
  "scope": {
    "task_family": "structured-owner-duty-currentness",
    "conditions": [
      "the exact runtime_subject source and digest match the runtime binding, and the 0.149.1 package members plus required companions are independently artifact-admitted before launch",
      "the selected realization, runtime profile, model slug, reasoning effort, permissions and tool profile match exactly",
      "the live Codex catalog remains compatible with the same runtime subject at launch time",
      "a new bounded real-work canary returns runtime receipts and separately reviewed evidence before any fit promotion"
    ],
    "exclusions": [
      "transferring any Codex 0.148.0 behavioral fit, task outcome, reliability, handoff, wake, resume, or acceptance claim",
      "transferring the 0.148.0 runtime profile, package-member identity, or currentness conclusion to the 0.149.1 subject",
      "using package metadata or artifact admission as activation, routing, process health, proof, or owner acceptance",
      "claiming general Luna competence, autonomy, initiative, evaluator authority, or task completion",
      "inferring closed-model internals or training lineage from runtime availability or behavior"
    ]
  },
  "evidence_modality": "inference_with_explicit_limits",
  "evidence_refs": [
    {
      "source_id": "codex-0.149.1-package-metadata-2026-08-24",
      "kind": "live_runtime_output",
      "uri": "runtime:codex-cli-standalone/0.149.1/package-metadata",
      "observed_at": "2026-08-24T06:23:38Z",
      "content_digest": "sha256:756dcadcf9e968f0e62fa92fd020f4592e92d27dacec9887882600d39df69d5b",
      "notes": "Immutable owner evidence declares the installed standalone package version and target; it does not prove model behavior or supply an acceptance decision."
    },
    {
      "source_id": "abyss-stack-0.149.1-runtime-subject-admission-2026-08-24",
      "kind": "live_runtime_output",
      "uri": "runtime:abyss-stack-external-codex-agent/active",
      "observed_at": "2026-08-24T06:23:38Z",
      "content_digest": "sha256:304089232ad96d67bf003f0fb59b2fccf305259ac5a1983e969aa6f1b85ca891",
      "notes": "The admitted runtime artifact trust gate binds the exact aggregate subject digest for this realization; package-member verification, runtime activation and process truth remain stronger-owner responsibilities."
    },
    {
      "source_id": "aoa-models-currentness-procedure-2026-08-24",
      "kind": "repository_source",
      "uri": "task-local:procedure:aoa-models.codex-0.149.1-luna-currentness.20260824.v1",
      "observed_at": "2026-08-24T06:23:38Z",
      "content_digest": "sha256:fedc1ce47e2758dbc77c280fc7d72700b08eae53848cf24604bfe0978726f666",
      "notes": "The owner procedure requires exact currentness/configuration evidence and an independent review gate; it does not authorize fit promotion or external effects."
    }
  ],
  "confidence_posture": "hypothesis",
  "observation_interval": {
    "start": "2026-08-24T06:23:38Z",
    "end": "2026-08-24T06:23:38Z"
  },
  "known_counterevidence": [
    {
      "source_id": "luna-codex-0.148.0-currentness-is-distinct-subject",
      "kind": "repository_source",
      "uri": "source/model-claims/luna-codex-0.148.0-currentness-nontransfer-hypothesis-v1.json",
      "observed_at": "2026-08-24T06:23:38Z",
      "content_digest": "sha256:304599b061bd195b509959f551c8596a1f3ba0c569fd8a6fb6f235d31a9ab7f1",
      "notes": "The 0.148.0 claim remains tied to its own runtime subject; it is preserved as historical/rollback context and supplies no 0.149.1 behavior, fit, reliability, wake, resume, or acceptance evidence."
    },
    {
      "source_id": "active-runtime-profile-0.148.0-does-not-prove-0.149.1",
      "kind": "live_runtime_output",
      "uri": "runtime:abyss-stack-external-codex-agent/runtime-profile",
      "observed_at": "2026-08-24T06:23:38Z",
      "content_digest": "sha256:7e7e2ba0fe7cfd26dc84bda19d1dc388c7f82d77dc47e1737307480bf8530e2f",
      "notes": "The immutable active profile still names Codex 0.148.0 and its prior runtime subject. This mismatch is retained as a continuation/launch residual and is not used to bind the 0.149.1 realization."
    }
  ],
  "freshness": {
    "status": "current",
    "review_by": null,
    "policy": "Reassess on any Codex version, package member, required companion, live catalog, runtime profile, access, effort, permission, or tool-profile change; behavioral fit remains unestablished until a fresh reviewed 0.149.1 canary."
  },
  "lifecycle": {
    "state": "hypothesis",
    "history": [
      {
        "from": null,
        "to": "hypothesis",
        "at": "2026-08-24T06:23:38Z",
        "reason": "Owner evidence declares Codex 0.149.1 package metadata and an exact admitted runtime subject. This establishes a bounded currentness candidate only; all 0.148.0 behavior and acceptance evidence is explicitly non-transferable.",
        "evidence_refs": [
          "codex-0.149.1-package-metadata-2026-08-24",
          "abyss-stack-0.149.1-runtime-subject-admission-2026-08-24",
          "active-runtime-profile-0.148.0-does-not-prove-0.149.1"
        ]
      }
    ],
    "superseded_by": null
  },
  "independent_review_refs": [],
  "attribution_limits": [
    "The exact subject digest is backed by owner artifact-admission evidence, while package-member verification and runtime activation remain with abyss-stack.",
    "The active runtime profile supplied as immutable evidence still names Codex 0.148.0; it cannot establish 0.149.1 profile compatibility.",
    "The 0.149.1 package metadata and subject admission prove configuration/currentness inputs only, not a real task, behavioral fit, reliability, wake delivery, resume, proof, or acceptance.",
    "No Codex 0.148.0 behavioral fit, task outcome, reliability, handoff, wake, resume, or acceptance conclusion is attributed to the 0.149.1 realization.",
    "A live catalog match, external-process canary, independent review, proof verdict, routing, activation and owner acceptance remain separately gated by stronger owners."
  ],
  "created_at": "2026-08-24T06:23:38Z",
  "updated_at": "2026-08-24T06:23:38Z"
}
